{"$id":"https://kody-w.github.io/rapp-hive-hub/api/hive-hub/v1/schemas/dialbook.schema.json","$schema":"https://json-schema.org/draft/2020-12/schema","additionalProperties":true,"properties":{"$schema":{"format":"uri","pattern":"^https://","type":"string"},"aliases":{"additionalProperties":{"items":{"additionalProperties":false,"properties":{"path":{"pattern":"^(?!/)(?!.*\\.\\.).+$","type":"string"},"ref":{"pattern":"^sha256:[a-f0-9]{64}$","type":"string"},"url":{"format":"uri","pattern":"^https://","type":"string"}},"required":["path","ref","url"],"type":"object"},"minItems":1,"type":"array"},"type":"object"},"candidateSemantics":{"const":"Every chant maps to an array; no candidate is unique authority."},"chant":{"properties":{"addressBits":{"const":49},"fullDialIdVerificationRequired":{"const":true},"protocol":{"const":"hive-hub-chant/1"},"vocabularyProvenance":{"minLength":1,"type":"string"},"vocabularySha256":{"const":"325f47d38851721f16cf111f80114d8d9146e84813fa6822fe2ad38dd18dbb36"}},"required":["protocol","vocabularyProvenance","vocabularySha256","addressBits","fullDialIdVerificationRequired"],"type":"object"},"chants":{"additionalProperties":{"items":{"additionalProperties":false,"properties":{"path":{"pattern":"^(?!/)(?!.*\\.\\.).+$","type":"string"},"ref":{"pattern":"^sha256:[a-f0-9]{64}$","type":"string"},"url":{"format":"uri","pattern":"^https://","type":"string"}},"required":["path","ref","url"],"type":"object"},"minItems":1,"type":"array"},"type":"object"},"generatedAt":{"minLength":1,"type":"string"},"kind":{"const":"public-dialbook"},"records":{"items":{"additionalProperties":false,"properties":{"path":{"pattern":"^(?!/)(?!.*\\.\\.).+$","type":"string"},"ref":{"pattern":"^sha256:[a-f0-9]{64}$","type":"string"},"url":{"format":"uri","pattern":"^https://","type":"string"}},"required":["path","ref","url"],"type":"object"},"type":"array"},"version":{"const":"1.0.0"}},"required":["$schema","chants","kind","records"],"title":"Hive Hub public dialbook","type":"object"}
