{"$schema":"https://kody-w.github.io/rapp-hive-hub/api/hive-hub/v1/schemas/dialbook.schema.json","aliases":{"ai-video-studio":[{"path":"api/hive-hub/v1/records/sha256/sha256-80-bf/bf67c89d8341b0ed12ae03aefe0576769a984b387cc943052e416f97ed8f85a9.json","ref":"sha256:bf67c89d8341b0ed12ae03aefe0576769a984b387cc943052e416f97ed8f85a9","url":"https://kody-w.github.io/rapp-hive-hub/api/hive-hub/v1/records/sha256/sha256-80-bf/bf67c89d8341b0ed12ae03aefe0576769a984b387cc943052e416f97ed8f85a9.json"}],"applied-invention-lab":[{"path":"api/hive-hub/v1/records/sha256/sha256-00-3f/0cfc0d2b53c11cae552ab288a5a55e6ec9ea62d5559b7fc27cb16682a1c18e18.json","ref":"sha256:0cfc0d2b53c11cae552ab288a5a55e6ec9ea62d5559b7fc27cb16682a1c18e18","url":"https://kody-w.github.io/rapp-hive-hub/api/hive-hub/v1/records/sha256/sha256-00-3f/0cfc0d2b53c11cae552ab288a5a55e6ec9ea62d5559b7fc27cb16682a1c18e18.json"}],"enterprise-transformation-firm":[{"path":"api/hive-hub/v1/records/sha256/sha256-80-bf/a3a02bb6b5ed5cad2ce6a98babd31f716bd04cb65a83ab2018cf4989e738f946.json","ref":"sha256:a3a02bb6b5ed5cad2ce6a98babd31f716bd04cb65a83ab2018cf4989e738f946","url":"https://kody-w.github.io/rapp-hive-hub/api/hive-hub/v1/records/sha256/sha256-80-bf/a3a02bb6b5ed5cad2ce6a98babd31f716bd04cb65a83ab2018cf4989e738f946.json"}],"federation-prime-contractor":[{"path":"api/hive-hub/v1/records/sha256/sha256-00-3f/174c73f3a117758340920f9082c9d9911db5551f2501828336498345c361b1e2.json","ref":"sha256:174c73f3a117758340920f9082c9d9911db5551f2501828336498345c361b1e2","url":"https://kody-w.github.io/rapp-hive-hub/api/hive-hub/v1/records/sha256/sha256-00-3f/174c73f3a117758340920f9082c9d9911db5551f2501828336498345c361b1e2.json"}],"hive-hub-public-lab":[{"path":"api/hive-hub/v1/records/sha256/sha256-40-7f/7d40d43e78f710bc7d1f40a6133b05834bcc0baba02ce9e75ecd90afe86e7844.json","ref":"sha256:7d40d43e78f710bc7d1f40a6133b05834bcc0baba02ce9e75ecd90afe86e7844","url":"https://kody-w.github.io/rapp-hive-hub/api/hive-hub/v1/records/sha256/sha256-40-7f/7d40d43e78f710bc7d1f40a6133b05834bcc0baba02ce9e75ecd90afe86e7844.json"}],"independent-game-studio":[{"path":"api/hive-hub/v1/records/sha256/sha256-40-7f/6c39862ea19ff9be39bd04883de90c7d39049c23752ad7a7a8709d5c37c6c26b.json","ref":"sha256:6c39862ea19ff9be39bd04883de90c7d39049c23752ad7a7a8709d5c37c6c26b","url":"https://kody-w.github.io/rapp-hive-hub/api/hive-hub/v1/records/sha256/sha256-40-7f/6c39862ea19ff9be39bd04883de90c7d39049c23752ad7a7a8709d5c37c6c26b.json"}],"micro-manufacturing-company":[{"path":"api/hive-hub/v1/records/sha256/sha256-c0-ff/c40bc04150cfec22c6bc791673c928ea3470a14ab9449c43fe94a7ce9aa3b570.json","ref":"sha256:c40bc04150cfec22c6bc791673c928ea3470a14ab9449c43fe94a7ce9aa3b570","url":"https://kody-w.github.io/rapp-hive-hub/api/hive-hub/v1/records/sha256/sha256-c0-ff/c40bc04150cfec22c6bc791673c928ea3470a14ab9449c43fe94a7ce9aa3b570.json"}],"one-person-conglomerate":[{"path":"api/hive-hub/v1/records/sha256/sha256-c0-ff/ffeb5f46140054f08b4857598f81958e68b55fdad16490b41b90592080a7ced1.json","ref":"sha256:ffeb5f46140054f08b4857598f81958e68b55fdad16490b41b90592080a7ced1","url":"https://kody-w.github.io/rapp-hive-hub/api/hive-hub/v1/records/sha256/sha256-c0-ff/ffeb5f46140054f08b4857598f81958e68b55fdad16490b41b90592080a7ced1.json"}],"open-source-infrastructure-foundation":[{"path":"api/hive-hub/v1/records/sha256/sha256-80-bf/a93c16c88d5870afd7b4570e0b2cb4717300c6c4b562b57076449fcae87827a7.json","ref":"sha256:a93c16c88d5870afd7b4570e0b2cb4717300c6c4b562b57076449fcae87827a7","url":"https://kody-w.github.io/rapp-hive-hub/api/hive-hub/v1/records/sha256/sha256-80-bf/a93c16c88d5870afd7b4570e0b2cb4717300c6c4b562b57076449fcae87827a7.json"}],"product-launch-company":[{"path":"api/hive-hub/v1/records/sha256/sha256-80-bf/9267a2b97f064c3958ffb04a44d26ef6aaca8cfc1eea1c15fe8b0cdf2b5beb92.json","ref":"sha256:9267a2b97f064c3958ffb04a44d26ef6aaca8cfc1eea1c15fe8b0cdf2b5beb92","url":"https://kody-w.github.io/rapp-hive-hub/api/hive-hub/v1/records/sha256/sha256-80-bf/9267a2b97f064c3958ffb04a44d26ef6aaca8cfc1eea1c15fe8b0cdf2b5beb92.json"}],"public-source-intelligence-bureau":[{"path":"api/hive-hub/v1/records/sha256/sha256-00-3f/042a756c183b79d30cdb29dc549fe5ece85f90779d99ea9c900f83ffa0d31011.json","ref":"sha256:042a756c183b79d30cdb29dc549fe5ece85f90779d99ea9c900f83ffa0d31011","url":"https://kody-w.github.io/rapp-hive-hub/api/hive-hub/v1/records/sha256/sha256-00-3f/042a756c183b79d30cdb29dc549fe5ece85f90779d99ea9c900f83ffa0d31011.json"}],"turnaround-firm":[{"path":"api/hive-hub/v1/records/sha256/sha256-c0-ff/d491b18c025981aea1d5e13d22ffa3b4f526e73bfc91c2388c09f324d0f36931.json","ref":"sha256:d491b18c025981aea1d5e13d22ffa3b4f526e73bfc91c2388c09f324d0f36931","url":"https://kody-w.github.io/rapp-hive-hub/api/hive-hub/v1/records/sha256/sha256-c0-ff/d491b18c025981aea1d5e13d22ffa3b4f526e73bfc91c2388c09f324d0f36931.json"}]},"candidateSemantics":"Every chant maps to an array; no candidate is unique authority.","chant":{"addressBits":49,"fullDialIdVerificationRequired":true,"protocol":"hive-hub-chant/1","vocabularyProvenance":"kody-w/rappid@c988d7975dadb6a8f055183cdbc4cbb17adfe2ae","vocabularySha256":"325f47d38851721f16cf111f80114d8d9146e84813fa6822fe2ad38dd18dbb36"},"chants":{"arbor-lark-kelp-lantern-dell-pine-quill":[{"path":"api/hive-hub/v1/records/sha256/sha256-00-3f/042a756c183b79d30cdb29dc549fe5ece85f90779d99ea9c900f83ffa0d31011.json","ref":"sha256:042a756c183b79d30cdb29dc549fe5ece85f90779d99ea9c900f83ffa0d31011","url":"https://kody-w.github.io/rapp-hive-hub/api/hive-hub/v1/records/sha256/sha256-00-3f/042a756c183b79d30cdb29dc549fe5ece85f90779d99ea9c900f83ffa0d31011.json"}],"drift-bramble-dune-rill-verge-gorse-vale":[{"path":"api/hive-hub/v1/records/sha256/sha256-80-bf/a3a02bb6b5ed5cad2ce6a98babd31f716bd04cb65a83ab2018cf4989e738f946.json","ref":"sha256:a3a02bb6b5ed5cad2ce6a98babd31f716bd04cb65a83ab2018cf4989e738f946","url":"https://kody-w.github.io/rapp-hive-hub/api/hive-hub/v1/records/sha256/sha256-80-bf/a3a02bb6b5ed5cad2ce6a98babd31f716bd04cb65a83ab2018cf4989e738f946.json"}],"frost-fenlark-alder-zenith-lichen-ember-kiln":[{"path":"api/hive-hub/v1/records/sha256/sha256-80-bf/9267a2b97f064c3958ffb04a44d26ef6aaca8cfc1eea1c15fe8b0cdf2b5beb92.json","ref":"sha256:9267a2b97f064c3958ffb04a44d26ef6aaca8cfc1eea1c15fe8b0cdf2b5beb92","url":"https://kody-w.github.io/rapp-hive-hub/api/hive-hub/v1/records/sha256/sha256-80-bf/9267a2b97f064c3958ffb04a44d26ef6aaca8cfc1eea1c15fe8b0cdf2b5beb92.json"}],"haven-yarrow-lantern-bluff-bluff-yew-vetch":[{"path":"api/hive-hub/v1/records/sha256/sha256-00-3f/0cfc0d2b53c11cae552ab288a5a55e6ec9ea62d5559b7fc27cb16682a1c18e18.json","ref":"sha256:0cfc0d2b53c11cae552ab288a5a55e6ec9ea62d5559b7fc27cb16682a1c18e18","url":"https://kody-w.github.io/rapp-hive-hub/api/hive-hub/v1/records/sha256/sha256-00-3f/0cfc0d2b53c11cae552ab288a5a55e6ec9ea62d5559b7fc27cb16682a1c18e18.json"}],"islet-quiver-delta-jade-hearth-hearth-haven":[{"path":"api/hive-hub/v1/records/sha256/sha256-40-7f/6c39862ea19ff9be39bd04883de90c7d39049c23752ad7a7a8709d5c37c6c26b.json","ref":"sha256:6c39862ea19ff9be39bd04883de90c7d39049c23752ad7a7a8709d5c37c6c26b","url":"https://kody-w.github.io/rapp-hive-hub/api/hive-hub/v1/records/sha256/sha256-40-7f/6c39862ea19ff9be39bd04883de90c7d39049c23752ad7a7a8709d5c37c6c26b.json"}],"ivy-heath-mire-cove-north-cedar-steppe":[{"path":"api/hive-hub/v1/records/sha256/sha256-80-bf/bf67c89d8341b0ed12ae03aefe0576769a984b387cc943052e416f97ed8f85a9.json","ref":"sha256:bf67c89d8341b0ed12ae03aefe0576769a984b387cc943052e416f97ed8f85a9","url":"https://kody-w.github.io/rapp-hive-hub/api/hive-hub/v1/records/sha256/sha256-80-bf/bf67c89d8341b0ed12ae03aefe0576769a984b387cc943052e416f97ed8f85a9.json"}],"jade-fjord-yew-zenith-zephyr-arbor-xenia":[{"path":"api/hive-hub/v1/records/sha256/sha256-c0-ff/c40bc04150cfec22c6bc791673c928ea3470a14ab9449c43fe94a7ce9aa3b570.json","ref":"sha256:c40bc04150cfec22c6bc791673c928ea3470a14ab9449c43fe94a7ce9aa3b570","url":"https://kody-w.github.io/rapp-hive-hub/api/hive-hub/v1/records/sha256/sha256-c0-ff/c40bc04150cfec22c6bc791673c928ea3470a14ab9449c43fe94a7ce9aa3b570.json"}],"karst-petrel-cedar-bluff-kiln-quartz-jade":[{"path":"api/hive-hub/v1/records/sha256/sha256-c0-ff/ffeb5f46140054f08b4857598f81958e68b55fdad16490b41b90592080a7ced1.json","ref":"sha256:ffeb5f46140054f08b4857598f81958e68b55fdad16490b41b90592080a7ced1","url":"https://kody-w.github.io/rapp-hive-hub/api/hive-hub/v1/records/sha256/sha256-c0-ff/ffeb5f46140054f08b4857598f81958e68b55fdad16490b41b90592080a7ced1.json"}],"lantern-jade-sable-pine-moss-nadir-knoll":[{"path":"api/hive-hub/v1/records/sha256/sha256-00-3f/174c73f3a117758340920f9082c9d9911db5551f2501828336498345c361b1e2.json","ref":"sha256:174c73f3a117758340920f9082c9d9911db5551f2501828336498345c361b1e2","url":"https://kody-w.github.io/rapp-hive-hub/api/hive-hub/v1/records/sha256/sha256-00-3f/174c73f3a117758340920f9082c9d9911db5551f2501828336498345c361b1e2.json"}],"lark-cobalt-zeal-zenith-verge-thicket-ledge":[{"path":"api/hive-hub/v1/records/sha256/sha256-40-7f/7d40d43e78f710bc7d1f40a6133b05834bcc0baba02ce9e75ecd90afe86e7844.json","ref":"sha256:7d40d43e78f710bc7d1f40a6133b05834bcc0baba02ce9e75ecd90afe86e7844","url":"https://kody-w.github.io/rapp-hive-hub/api/hive-hub/v1/records/sha256/sha256-40-7f/7d40d43e78f710bc7d1f40a6133b05834bcc0baba02ce9e75ecd90afe86e7844.json"}],"ledge-ester-aspen-lantern-thicket-prairie-nook":[{"path":"api/hive-hub/v1/records/sha256/sha256-c0-ff/d491b18c025981aea1d5e13d22ffa3b4f526e73bfc91c2388c09f324d0f36931.json","ref":"sha256:d491b18c025981aea1d5e13d22ffa3b4f526e73bfc91c2388c09f324d0f36931","url":"https://kody-w.github.io/rapp-hive-hub/api/hive-hub/v1/records/sha256/sha256-c0-ff/d491b18c025981aea1d5e13d22ffa3b4f526e73bfc91c2388c09f324d0f36931.json"}],"osprey-lark-reed-delta-frost-briar-atlas":[{"path":"api/hive-hub/v1/records/sha256/sha256-80-bf/a93c16c88d5870afd7b4570e0b2cb4717300c6c4b562b57076449fcae87827a7.json","ref":"sha256:a93c16c88d5870afd7b4570e0b2cb4717300c6c4b562b57076449fcae87827a7","url